{
  "schemaVersion": "2.0.0",
  "project": {
    "id": "proj-empty-001",
    "name": "Empty Project",
    "createdAt": "2026-07-24T14:00:00.000Z",
    "updatedAt": "2026-07-24T14:00:00.000Z"
  },
  "nodes": [],
  "edges": [],
  "contracts": [],
  "deploymentEnvironments": [],
  "macroBlocks": [],
  "portalBuses": [],
  "validationResults": [],
  "viewport": {
    "x": 0,
    "y": 0,
    "zoom": 1
  },
  "workflow": {
    "tasks": [],
    "transitions": [],
    "input": "",
    "maxParallelTasks": 4,
    "viewport": {
      "x": 0,
      "y": 0,
      "zoom": 1
    }
  }
}
